{
    "$schema": "http://json-schema.org/draft-07/schema#",
    "type": "array",
    "items": {
        "type": "object",
        "required": [
            "department",
            "image"
        ],
        "additionalProperties": false,
        "properties": {
            "department": {
                "type": "string",
                "enum": ["computer-engineering", "electrical-and-electronics-engineering", "electronics-and-communication-engineering", "mechanical-engineering", "civil-engineering"]
            },
            "name": {
                "type": "string",
                "enum": ["Computer Engineering", "Electrical and Electronics Engineering", "Electronics and Communication Engineering", "Mechanical Engineering", "Civil Engineering"]
            },
            "url": {
                "type": "string",
                "description": "Department URL"
            },
            "image": {
                "type": "string",
                "description": "Department featured image"
            }
        }
    }
}
